{
  "schema_id": "ECTOS_PACKAGE_DEPENDENCY_GRAPH_V01",
  "package": {
    "package_id": "ECTOS_DEV_SAMPLE_PACKAGE",
    "package_name": "engineering/phase01/fixtures/sample-package",
    "version": "0.0.1",
    "package_sha256": null,
    "environment": "ECTOS_DEV",
    "producer": "ECTOS_ENGINEERING",
    "source_repository": "yannicklabuthie-code/ECTOS-Engineering",
    "source_commit": null
  },
  "nodes": [
    {"dependency_id":"PKG","type":"PACKAGE","name":"ECTOS_DEV_SAMPLE_PACKAGE","locator":"engineering/phase01/fixtures/sample-package","currentness":"CURRENT","physical_evidence":"package fixture directory","test_coverage":"phase01 assurance","fail_closed_behavior":"deny qualification","impact_if_changed":"rerun complete package assurance","external_ref":null},
    {"dependency_id":"ENTRYPOINT","type":"SOURCE_FILE","name":"main.ps1","locator":"main.ps1","currentness":"CURRENT","physical_evidence":"package member","test_coverage":"parse/install-load/native gates","fail_closed_behavior":"deny qualification","impact_if_changed":"parse/native/output contract","external_ref":null},
    {"dependency_id":"MANIFEST","type":"CONFIGURATION","name":"ectos-package-manifest.json","locator":"ectos-package-manifest.json","currentness":"CURRENT","physical_evidence":"package member","test_coverage":"package manifest gate","fail_closed_behavior":"deny qualification","impact_if_changed":"package identity/runtime/dependency contract","external_ref":null},
    {"dependency_id":"PS51","type":"OS_RUNTIME","name":"Windows PowerShell 5.1 Desktop","locator":"powershell.exe","currentness":"CURRENT","physical_evidence":"engineering native contract","test_coverage":"native_ps51 gate","fail_closed_behavior":"deny qualification","impact_if_changed":"native execution qualification","external_ref":null},
    {"dependency_id":"ENGINEERING","type":"ENGINE","name":"ECTOS Engineering Assurance","locator":"engineering/phase01","currentness":"CURRENT","physical_evidence":"repository assurance implementation","test_coverage":"CI required checks","fail_closed_behavior":"deny readiness","impact_if_changed":"all package assurance results","external_ref":null}
  ],
  "edges": [
    {"edge_id":"E1","from":"PKG","to":"ENTRYPOINT","type":"LOADS","direct_or_transitive":"DIRECT","required_by":"package entrypoint","contract":"entrypoint","currentness":"CURRENT","physical_evidence":"manifest entrypoint field","test_coverage":"install-load","fail_closed_behavior":"deny qualification","status":"RESOLVED"},
    {"edge_id":"E2","from":"PKG","to":"MANIFEST","type":"REQUIRES","direct_or_transitive":"DIRECT","required_by":"package identity","contract":"ECTOS_COMMON_PACKAGE_MANIFEST_V0","currentness":"CURRENT","physical_evidence":"manifest member","test_coverage":"package-manifest","fail_closed_behavior":"deny qualification","status":"RESOLVED"},
    {"edge_id":"E3","from":"ENTRYPOINT","to":"PS51","type":"EXECUTES_ON","direct_or_transitive":"DIRECT","required_by":"runtime","contract":"WindowsPowerShell5.1","currentness":"CURRENT","physical_evidence":"manifest target_runtime","test_coverage":"native-ps51","fail_closed_behavior":"deny qualification","status":"RESOLVED"},
    {"edge_id":"E4","from":"PKG","to":"ENGINEERING","type":"QUALIFIED_BY","direct_or_transitive":"DIRECT","required_by":"qualification","contract":"ECTOS Engineering Assurance","currentness":"CURRENT","physical_evidence":"CI workflow","test_coverage":"ci-required-checks","fail_closed_behavior":"deny readiness","status":"RESOLVED"}
  ],
  "closure": {
    "dependency_closure": "PASS",
    "undeclared_dependency_count": 0,
    "unresolved_transitive_dependency_count": 0,
    "untested_dependency_count": 0,
    "implicit_environment_assumption_count": 0,
    "unknown_blast_radius_edge_count": 0
  },
  "change_impact": {
    "predecessor_package_sha256": null,
    "changed_dependency_ids": [],
    "impacted_dependency_ids": [],
    "analysis_status": "NOT_APPLICABLE"
  }
}
